校纪委组织召开党风廉政宣传教育专题会,https://news.ruc.edu.cn/archives/4839,2009-11-09
密歇根大学孔子学院揭牌 人民大学民乐团献上民乐盛宴,https://news.ruc.edu.cn/archives/4840,2009-11-07
纪校长会见来校学习的津巴布韦总统夫人格蕾丝·穆加贝,https://news.ruc.edu.cn/archives/4841,2009-11-06
日本首相鸠山由纪夫复信纪宝成校长表示感谢,https://news.ruc.edu.cn/archives/4842,2009-11-06
纪宝成校长深入研究生课堂了解课程教学情况,https://news.ruc.edu.cn/archives/4843,2009-11-06
国务院学位办学位授予和人才培养学科专业目录（社会科学领域）修订研讨会在人民大学召开,https://news.ruc.edu.cn/archives/4844,2009-11-06
《饶宗颐二十世纪学术文集》简体字版新书发布会在香港举行,https://news.ruc.edu.cn/archives/4845,2009-11-06
南昌大学副校长一行来人民大学进行产业调研,https://news.ruc.edu.cn/archives/4846,2009-11-06
第二届世界汉学大会在人民大学举行 刘延东致信祝贺,https://news.ruc.edu.cn/archives/4847,2009-11-05
牛维麟常务副书记出席国际应用科技开发协作网第十四次全体会员大会,https://news.ruc.edu.cn/archives/4848,2009-11-05
普林斯顿大学副教务长戴安娜•K•戴维斯访问人民大学,https://news.ruc.edu.cn/archives/4849,2009-11-04
美国普渡大学卡柳梅特分校副校长一行访问人民大学,https://news.ruc.edu.cn/archives/4850,2009-11-03
教育部授予陈及时、方招、何旭东、卢帅4名同学“全国舍己救人优秀大学生”称号,https://news.ruc.edu.cn/archives/4851,2009-11-03
第二届世界汉学大会闭幕,https://news.ruc.edu.cn/archives/4852,2009-11-03
香港立法会原主席、十一届全国人大常委会委员范徐丽泰女士受聘中国人民大学名誉教授,https://news.ruc.edu.cn/archives/4853,2009-11-03
程天权书记出席全国高校马克思主义理论学科博士生导师论坛并讲话,https://news.ruc.edu.cn/archives/4854,2009-11-03
国际信息系统协会主席Bernard Tan教授访问信息学院,https://news.ruc.edu.cn/archives/4855,2009-10-31
人民大学召开防控甲型H1N1流感工作会议,https://news.ruc.edu.cn/archives/4856,2009-10-31
暨南大学、西南交通大学学生工作系统同志来人民大学交流,https://news.ruc.edu.cn/archives/4857,2009-10-31
中国人民大学中国调查与数据中心举行揭牌仪式暨中心工作总结与发展规划汇报会,https://news.ruc.edu.cn/archives/4858,2009-10-31
中国人民大学宗教高等研究院揭牌  中外学者汇聚高峰论坛,https://news.ruc.edu.cn/archives/4860,2009-10-30
教育部直属高校工作司副司长牛燕冰到中国人民大学高等教育研究室调研,https://news.ruc.edu.cn/archives/4861,2009-10-30
程天权书记参加全国干部教育培训高校基地暨中央和国家司局级干部自主选学试点工作会议,https://news.ruc.edu.cn/archives/4862,2009-10-29
人民大学召开窗口部门座谈会,https://news.ruc.edu.cn/archives/4863,2009-10-29
纪宝成校长应邀到绍兴文理学院做报告,https://news.ruc.edu.cn/archives/4864,2009-10-29
纪宝成校长赴浙江义乌市考察调研,https://news.ruc.edu.cn/archives/4865,2009-10-29
人民大学举行信息学院院长公开竞聘面试会,https://news.ruc.edu.cn/archives/4866,2009-10-29
人民大学召开2010年暑期学校（国际小学期）工作布署会议,https://news.ruc.edu.cn/archives/4867,2009-10-29
“《许崇德全集》出版座谈暨许崇德宪法理论研讨会”举行 纪宝成校长到会致辞,https://news.ruc.edu.cn/archives/4868,2009-10-29
纪宝成校长出席2009年高等教育国际论坛并发表演讲,https://news.ruc.edu.cn/archives/4869,2009-10-29
袁卫常务副校长主持召开全校行政管理工作会议相关部门协调会,https://news.ruc.edu.cn/archives/4870,2009-10-28
学校领导继续深入课堂了解教学情况,https://news.ruc.edu.cn/archives/4871,2009-10-28
薛浣白副校长赴比利时参加欧洲地区孔子学院2009年联席会议,https://news.ruc.edu.cn/archives/4872,2009-10-27
文化部文化产业司李小磊、吴江波副司长到中国人民大学文化科技园调研,https://news.ruc.edu.cn/archives/4873,2009-10-27
中国人民大学师生热议《朱镕基答记者问》,https://news.ruc.edu.cn/archives/4874,2009-10-27
中国人民大学主持召开“应用统计硕士专业学位”、“金融硕士专业学位”专家论证会,https://news.ruc.edu.cn/archives/4875,2009-10-27
中国人民大学79级校友入学三十周年返校活动举行,https://news.ruc.edu.cn/archives/4876,2009-10-27
“中国管理哲学创新论坛 2009”年度论坛在中国人民大学举办,https://news.ruc.edu.cn/archives/4877,2009-10-27
中国人民大学举办2009年国际文化节,https://news.ruc.edu.cn/archives/4878,2009-10-27
第二届世界汉学大会即将在中国人民大学举行,https://news.ruc.edu.cn/archives/4879,2009-10-27
“人民的期待”《朱镕基答记者问》读书活动在中国人民大学举行,https://news.ruc.edu.cn/archives/4880,2009-10-26
王利明副书记兼副校长出席教育部法学学科教学指导委员会、中国法学会法学教育研究会年会,https://news.ruc.edu.cn/archives/4881,2009-10-26
土耳其驻华大使穆拉特•萨利姆•埃森利先生在人民大学发表演讲,https://news.ruc.edu.cn/archives/4882,2009-10-26
中国粮食安全60年高层研讨会及华润集团捐资仪式在人民大学举行,https://news.ruc.edu.cn/archives/4883,2009-10-26
中国人民大学应邀参加中国名校苏州创新合作论坛,https://news.ruc.edu.cn/archives/4884,2009-10-24
瑞士驻华使馆贺满崐参赞人大演讲瑞士的教育与科研,https://news.ruc.edu.cn/archives/4885,2009-10-24
加拿大驻华大使马大维先生人大演讲：看到一个更多元的中国,https://news.ruc.edu.cn/archives/4886,2009-10-24
北京市海淀供电公司经理周彤受聘中国人民大学校董,https://news.ruc.edu.cn/archives/4887,2009-10-23
程天权书记与学生代表座谈,https://news.ruc.edu.cn/archives/4888,2009-10-23
纪宝成校长应邀出席“祖国不会忘记图片展”并剪彩,https://news.ruc.edu.cn/archives/4889,2009-10-22
日本首相鸠山由纪夫接受《环球时报》专访　忆及9年前在人民大学的讲演,https://news.ruc.edu.cn/archives/4890,2009-10-22
校领导深入课堂揭开“听课月”序幕,https://news.ruc.edu.cn/archives/4891,2009-10-22
袁卫常务副校长赴肯尼亚参加非洲地区孔子学院2009年联席会议,https://news.ruc.edu.cn/archives/4892,2009-10-22
程天权书记应邀出席中国矿业大学建校100周年庆祝大会,https://news.ruc.edu.cn/archives/4893,2009-10-21
英国肯特大学副校长一行访问人民大学,https://news.ruc.edu.cn/archives/4894,2009-10-21
纪宝成校长会见日本多摩大学校长寺岛实郎,https://news.ruc.edu.cn/archives/4895,2009-10-21
杨慧林副校长视察国际学院（苏州研究院） 并与学生座谈,https://news.ruc.edu.cn/archives/4896,2009-10-20
中国人民大学艺术学院庆祝建院十周年,https://news.ruc.edu.cn/archives/4897,2009-10-20
薛浣白副校长应邀率团赴台出访,https://news.ruc.edu.cn/archives/4898,2009-10-20
冯惠玲副校长出席法兰克福书展,https://news.ruc.edu.cn/archives/4899,2009-10-20
薛浣白副校长率团赴台进行学术交流,https://news.ruc.edu.cn/archives/4900,2009-10-19
纪宝成校长应邀赴宁波考察雅戈尔集团股份有限公司,https://news.ruc.edu.cn/archives/4901,2009-10-19
纪宝成校长应邀出席中央财经大学建校60周年庆祝大会,https://news.ruc.edu.cn/archives/4902,2009-10-19
国际学院（苏州研究院）召开全体教职工会议  传达纪宝成校长视察讲话精神,https://news.ruc.edu.cn/archives/4903,2009-10-19
纪宝成校长出席国际学院（苏州研究院）建设及开学工作总结答谢会,https://news.ruc.edu.cn/archives/4904,2009-10-19
机关党委召开支部书记座谈会  探讨一流大学管理工作,https://news.ruc.edu.cn/archives/4905,2009-10-17
澳大利亚新南威尔士大学校长代表团访问人民大学,https://news.ruc.edu.cn/archives/4906,2009-10-17
中国人民大学校纪委组织新任领导干部集体廉政谈话,https://news.ruc.edu.cn/archives/4907,2009-10-17
第四届“黄达－蒙代尔经济学奖”颁奖典礼暨学术演讲举行,https://news.ruc.edu.cn/archives/4908,2009-10-17
阿拉斯加大学安克雷奇分校教务长代表团来访人民大学,https://news.ruc.edu.cn/archives/4909,2009-10-16
人民大学荣获“首都国庆60周年群众游行优秀组织单位”称号,https://news.ruc.edu.cn/archives/4910,2009-10-16
中国人民大学2009年中青年骨干培训班举行开班仪式,https://news.ruc.edu.cn/archives/4911,2009-10-16
纪宝成校长考察国际学院（苏州研究院）工作,https://news.ruc.edu.cn/archives/4912,2009-10-16
挪威理工大学代表团访问中国人民大学 两校续签校际友好交流协议书,https://news.ruc.edu.cn/archives/4913,2009-10-16
