中国人民大学支援延安大学马克思主义理论学科建设工作启动,https://news.ruc.edu.cn/archives/249827,2019-06-22
马克思主义学院教授王易当选北京市妇联副主席,https://news.ruc.edu.cn/archives/249865,2019-06-22
中国人民大学召开2019届毕业生代表座谈会,https://news.ruc.edu.cn/archives/249620,2019-06-21
中国人民大学2019年博士学位授予仪式举行  429人获授博士学位,https://news.ruc.edu.cn/archives/249498,2019-06-21
吴付来副书记赴甘肃开展招生宣讲活动并看望校友代表,https://news.ruc.edu.cn/archives/249818,2019-06-21
环境学院2019届硕士学位、学士学位授予仪式暨毕业典礼举行,https://news.ruc.edu.cn/archives/249566,2019-06-21
财政金融学院2019年学位授予仪式暨毕业典礼举行,https://news.ruc.edu.cn/archives/249622,2019-06-21
数学学院2019年学位授予仪式暨毕业典礼举行,https://news.ruc.edu.cn/archives/249570,2019-06-21
平壤科技大学副校长率团访问中国人民大学,https://news.ruc.edu.cn/archives/249523,2019-06-21
劳动人事学院2019届学位授予仪式暨毕业典礼举行,https://news.ruc.edu.cn/archives/249504,2019-06-21
历史学院2019届毕业生学位授予仪式暨毕业典礼举行,https://news.ruc.edu.cn/archives/249923,2019-06-21
中国人民大学首届“毕业杯”足球赛举办,https://news.ruc.edu.cn/archives/249727,2019-06-21
经济学院2019年毕业日系列活动举办,https://news.ruc.edu.cn/archives/249461,2019-06-21
教育学院2019届学位授予仪式暨毕业典礼举行,https://news.ruc.edu.cn/archives/249446,2019-06-20
应用经济学院2019届硕士、学士学位授予仪式暨毕业典礼举行,https://news.ruc.edu.cn/archives/249413,2019-06-20
2019年中国人民大学教学标兵评选结果揭晓,https://news.ruc.edu.cn/archives/249296,2019-06-19
国际学院、中法学院2019届学位授予仪式暨毕业典礼举行,https://news.ruc.edu.cn/archives/249310,2019-06-19
靳诺书记一行考察丝路学院,https://news.ruc.edu.cn/archives/249353,2019-06-19
商学院2019届学位授予仪式暨毕业典礼举行,https://news.ruc.edu.cn/archives/249276,2019-06-19
吴付来副书记会见新加坡国立大学代表团,https://news.ruc.edu.cn/archives/249266,2019-06-19
刘伟校长一行赴宁夏洽谈区校项目合作并开展调研,https://news.ruc.edu.cn/archives/249243,2019-06-18
信息学院2019年毕业典礼暨学位授予仪式举行,https://news.ruc.edu.cn/archives/249218,2019-06-18
艺术学院2019届毕业生学位授予仪式暨毕业典礼举行,https://news.ruc.edu.cn/archives/249176,2019-06-18
马克思主义学院2019届毕业生学位授予仪式暨毕业典礼举行,https://news.ruc.edu.cn/archives/249104,2019-06-18
中国人民大学召开第十八次研究生代表大会,https://news.ruc.edu.cn/archives/249171,2019-06-18
“向祖国报到”2019年中国人民大学毕业生文艺晚会举办,https://news.ruc.edu.cn/archives/249159,2019-06-18
杜鹏副校长赴青海商谈省校合作并看望选调生,https://news.ruc.edu.cn/archives/249056,2019-06-17
中国人民大学2019年毕业摄影展暨“影载七十变迁”特别展开幕,https://news.ruc.edu.cn/archives/248980,2019-06-14
中国人民大学年鉴编纂及校史资源平台一期开通仪式暨《中国人民大学年鉴》（2019版）编纂工作启动会举行,https://news.ruc.edu.cn/archives/249017,2019-06-14
中国人民大学召开2019年招生动员大会,https://news.ruc.edu.cn/archives/248822,2019-06-13
2019届赴基层就业毕业生训练营结营暨欢送仪式举行,https://news.ruc.edu.cn/archives/248689,2019-06-13
教育部直属高校教师职称评审监管工作专家组到中国人民大学进行现场检查,https://news.ruc.edu.cn/archives/248647,2019-06-13
吴玉章学术论坛暨“优秀年轻干部”学术沙龙第五期开讲,https://news.ruc.edu.cn/archives/248678,2019-06-13
中国人民大学召开2018-2019学年春季学期本科教学期末工作会议,https://news.ruc.edu.cn/archives/248731,2019-06-13
中国人民大学交通安全委员会召开第二次会议,https://news.ruc.edu.cn/archives/248653,2019-06-13
中国人民大学部署“双一流”建设中期自评工作,https://news.ruc.edu.cn/archives/248536,2019-06-12
西藏大学副校长杨丹一行来校调研,https://news.ruc.edu.cn/archives/248519,2019-06-12
中国人民大学启动第三轮校党委巡察工作,https://news.ruc.edu.cn/archives/248153,2019-06-11
摩洛哥穆罕默德六世环保基金会秘书长诺扎•阿拉维访问中国人民大学,https://news.ruc.edu.cn/archives/248492,2019-06-11
中国人民大学大学生创业训练2018结项表彰会暨2019立项会举办,https://news.ruc.edu.cn/archives/248396,2019-06-11
首届全国高校思想政治理论课建设高端论坛在中国人民大学举办,https://news.ruc.edu.cn/archives/248164,2019-06-10
财政金融学院教授贾俊雪入党发展会召开 靳诺书记谈话,https://news.ruc.edu.cn/archives/248303,2019-06-10
“数学专业建设与拔尖人才培养”专家论证会召开,https://news.ruc.edu.cn/archives/248540,2019-06-09
中国人民大学召开心理学一级学科博士学位授权点专家论证会,https://news.ruc.edu.cn/archives/248379,2019-06-08
国家重大科研仪器研制专项结题验收会在中国人民大学举办,https://news.ruc.edu.cn/archives/247967,2019-06-06
中国文化大学校长徐兴庆率团访问中国人民大学,https://news.ruc.edu.cn/archives/247928,2019-06-06
《张敦富文集》发布会在中国人民大学举办,https://news.ruc.edu.cn/archives/247875,2019-06-05
“另存VI”中国人民大学水墨创作展开幕,https://news.ruc.edu.cn/archives/247847,2019-06-05
吴晓球副校长率团访问澳门特别行政区,https://news.ruc.edu.cn/archives/247887,2019-06-05
中国人民大学获得第十届“挑战杯”首都大学生课外学术科技作品竞赛“优胜杯”,https://news.ruc.edu.cn/archives/247695,2019-06-05
北京高校第十一届青年教师教学基本功大赛社科思政类比赛在中国人民大学举办,https://news.ruc.edu.cn/archives/247729,2019-06-04
第十届“外教社杯”全国高校外语教学大赛（大学英语组）北京赛区比赛举办,https://news.ruc.edu.cn/archives/247755,2019-06-04
新中国70年经济建设实践与理论研讨会暨中国政治经济学年度发展报告发布会在中国人民大学举办,https://news.ruc.edu.cn/archives/247302,2019-06-03
中国人民大学代表团访问爱尔兰、荷兰、比利时,https://news.ruc.edu.cn/archives/247622,2019-06-03
中国人民大学举办“5.25”心理健康月减压游园会,https://news.ruc.edu.cn/archives/247642,2019-06-02
“国际组织人才培养”系列讲座第八讲举办 何昌垂讲述“我的联合国之路”,https://news.ruc.edu.cn/archives/246502,2019-06-01
2019档案学深造证书班（北京）在中国人民大学开班,https://news.ruc.edu.cn/archives/247376,2019-05-31
德语经典作家学术研讨会·茨威格作品集发布会暨张玉书先生追思会在中国人民大学举办,https://news.ruc.edu.cn/archives/246620,2019-05-31
中国就业形势分析暨《中国失业率调查》项目启动会在中国人民大学举办,https://news.ruc.edu.cn/archives/247418,2019-05-31
“历史、人文视野下的自然与健康”国际学术研讨会在中国人民大学举办,https://news.ruc.edu.cn/archives/247394,2019-05-31
挪威卑尔根大学副校长安娜琳·埃里克森访问中国人民大学,https://news.ruc.edu.cn/archives/247250,2019-05-31
庆祝新中国成立70周年中国人民大学校友书法篆刻作品展开幕,https://news.ruc.edu.cn/archives/247174,2019-05-31
中国人民大学举办全体中层干部学习贯彻 《中共中央关于加强党的政治建设的意见》培训班,https://news.ruc.edu.cn/archives/247222,2019-05-30
中国人民大学2018级“红船领航”计划马克思主义经典研习会举行,https://news.ruc.edu.cn/archives/247200,2019-05-30
第一届首都治理论坛暨首届首都治理最佳实践评选启动仪式在中国人民大学举行,https://news.ruc.edu.cn/archives/247192,2019-05-30
中国人民大学“一带一路”全球导师计划启动,https://news.ruc.edu.cn/archives/247135,2019-05-30
中国人民大学2019校友工作研讨会召开,https://news.ruc.edu.cn/archives/247139,2019-05-30
北京市第十五届哲学社会科学优秀成果奖揭晓 中国人民大学获奖总数位列第一,https://news.ruc.edu.cn/archives/247081,2019-05-29
中国人民大学与河北省签署全面深化合作协议,https://news.ruc.edu.cn/archives/247111,2019-05-29
中国人民大学召开承办北京高校第十一届青教赛社科思政组比赛筹备工作协调会,https://news.ruc.edu.cn/archives/247019,2019-05-29
中国人民大学举办“人大绿茵41年” 足球友谊赛,https://news.ruc.edu.cn/archives/247162,2019-05-29
刘伟校长走访查看本科生课堂,https://news.ruc.edu.cn/archives/246902,2019-05-28
中国人民大学法学院教授张希坡获第二届“全国杰出资深法学家”称号,https://news.ruc.edu.cn/archives/246860,2019-05-28
“我和我的祖国”中国人民大学庆祝新中国成立70周年合唱音乐会唱响明德堂,https://news.ruc.edu.cn/archives/246793,2019-05-28
